{
  "type": "communication:outbound",
  "channel": "email",
  "to": {
    "address": "alice@example.com",
    "soulAgentId": null,
    "displayName": "Alice"
  },
  "subject": "Re: Project collaboration",
  "body": "Hi Alice,\\n\\nYes — happy to collaborate.\\n",
  "sentAt": "2026-03-04T12:00:05Z",
  "messageId": "comm-out-001",
  "inReplyTo": "comm-msg-001",
  "status": "accepted",
  "provider": "migadu",
  "providerMessageId": "migadu:abc123"
}
